<?xml version="1.0" encoding="utf-8"?>
<Data  xmlns="xsd"
           xmlns:ns="http://www.w3.org/2001/XMLSchema-instance"
           ns:schemaLocation="xsd C:\_SVN\ECoGmeToo\trunk\sources\ParadigmTools\src\main\Paradigm\ParadigmSchema.xsd">

  <Paradigm BaseFolder="media/">
    <Task ns:type="SingleTask" ID="ST_PreParadigm" DurationSeconds="10">
      <Stimulus ns:type="TextStimulus" Caption="+"/>
    </Task>
    <Task ns:type="SingleTask" ID="ST_Video" DurationSeconds="50" Group="1">
      <Stimulus ns:type="VideoStimulus" FileName="video_testdata.mp4"/>
    </Task>
    <Task ns:type="SingleTask" ID="ST_PostParadigm" DurationSeconds="5">
      <Stimulus ns:type="TextStimulus" Caption="Thank You!"/>
    </Task>
  </Paradigm>

</Data>